{
  "workflow": "speckit",
  "specName": "wibey provider support",
  "branch": "393-wibey-provider-support",
  "currentStep": "implement",
  "status": "implemented",
  "history": [
    {
      "step": "specify",
      "substep": null,
      "kind": "start",
      "by": "extension",
      "at": "2026-07-09T00:00:00.000Z"
    },
    {
      "step": "specify",
      "substep": null,
      "kind": "complete",
      "by": "ai",
      "at": "2026-07-09T00:00:01.000Z"
    },
    {
      "step": "plan",
      "substep": null,
      "kind": "start",
      "by": "extension",
      "at": "2026-07-09T00:01:00.000Z"
    },
    {
      "step": "plan",
      "substep": "research",
      "kind": "complete",
      "by": "ai",
      "at": "2026-07-09T00:02:00.000Z"
    },
    {
      "step": "plan",
      "substep": "design",
      "kind": "complete",
      "by": "ai",
      "at": "2026-07-09T00:03:00.000Z"
    },
    {
      "step": "plan",
      "substep": null,
      "kind": "complete",
      "by": "ai",
      "at": "2026-07-09T00:03:01.000Z"
    }
  ],
  "approach": "CLI-only Phase 1: WibeyCliProvider extends CliTerminalProvider with zero overrides (binary=wibey, flag=-p). wibey-vscode deferred to Phase 2 pending wibey.sendPrompt InnerSource contribution to genaica/wibey-vscode-extension."
}
