{
  "workflow": "speckit",
  "specName": "Demo — Specified",
  "branch": "demo/specified",
  "selectedAt": "2026-05-20T20:00:00.000Z",
  "currentStep": "specify",
  "status": "specified",
  "history": [
    {
      "step": "specify",
      "substep": null,
      "kind": "start",
      "from": {
        "step": null,
        "substep": null
      },
      "by": "extension",
      "at": "2026-05-20T20:00:00.000Z"
    },
    {
      "step": "specify",
      "substep": null,
      "kind": "complete",
      "by": "ai",
      "at": "2026-05-20T20:05:00.000Z"
    }
  ],
  "telemetryInstanceId": "4da56fc0-5dbe-49fd-bc94-7501e1e39b4b"
}